"a disagrees on climate change, emissions, energy, immigration, healthcare, cannabis and guns. outcome? 4.6% growth, leading the us. hmm...", 1
"id someone yelled climate change in 1845 when we got 8 in of snow", 0
"limate change imjacts food security as crop yields decline due to changes in temp, rainfall &amp; increased csimate variability", 1
"sa to those complaining about how cold it is, climate change is real. its happening. #thankuforyourtim", 1
"hy dont christian conservatives worry about climate change? god.  ", 1
"his picture is responsible for global warming", 0
" know global warming is real but tbh i think its nowed in louisiana twice this year bc everyone misses my damn yankee as", 1
"t's 20 global warming degrees right now!", 0
"idding the use of fossil fuel completely may be the only way to put a stop to global warming #earthtopari", 1
"he u.s. could learn from china about climate change policy | opinion ", 1
" thought you guys were the weather channel, not the climate change channel", 0
"s a businessman .should favour climate change. more business opportunities", 0
"e are in desperate need of leadership that prioritizes climate change as the threat it truly is. ", 1
"he issue offers our liberal shepherds no opportunities for virtue signaling on capital punishment, global warming ", -1
" just don't see how government action can put a dent on climate change. we are not that signifi ", -1
"asnt that the democrats points in the election? fear trump! fear global warming, now hate all wh", -1
"elp people seeking asylum and take action on climate change.  - ", 1
"hat about that one idiot who gets to see them everyday but still denies global warming", 1
"f we stopped emitting greenhouse gases right now, would we stop climate change?  ", 1
"hina very kindly explains to trump that it didnt invent climate change as a hoax.  via", 1
"he words climate change need to be noted. ", 1
"$q$ll mail anyone $2,000, if they can give me one shred of proof that global warming is man made. i don$q$t want opinion, but real proof", -1
"il and coal aren$q$t the answer. phony climate change agenda for companies profits. $$$", -1
"ord stern, climate change denier?  ", 1
"ake news and not global warming like you and sanders kept harping about when isis is a big problem", -1
"ucus and brick red marigolds global warming olive enough winky smon", 0
"e can brighten clouds to reflect heat and reduce global warming. but should we? ", 1
"o you are a climate change denier?i believe the climate scientist rather than climate deniers cause they go ", 1
"nd w/o seeing it: who pushes global warming: clinton, media, npr, colbert,  olympic committee, and i should trust them? #standupforscienc", 0
"hy even the people who worry the most about climate change often take little action - washington post ", 1
"ife behind a mask  china's cities still choking on smog | environment| all topics from climate change to... ", 1
"emarkable:all roads lead to soros funded orgs....especially the illuminati hoax: global warming #eyeswideopen ", -1
"on't let fake news tell you that climate change is damaging this country's future. outrageous", -1
"benefits from global warming - not wanted in nyc - makes it harder to get healthcare - didn't get the most vote", 0
"hen it's global it's not weather, it's climate change", 1
"ro-leftest agenda including global warming and the palestinians", -1
"hanks. that's my thing. along with fighting global warming! check out my other t feed, #climageddo", 1
"all climate change what it is: violence | rebecca solnit ", 1
"f you choose not to believe in global warming, i choose to believe the guy wearing the affliction shirt at the party won't start a fight", 1
"aving the world from climate change, black lives matter support, and urging nasa to work on muslim outreach ... ;-", 0
"n climate change: $q$pope francis is tapping the deeply held value of protecting the poor and the young.$q$ #nytletters ", 1
" feel like climate change is personally attacking canada this wee", 0
"nvironmentalists cried hoarse for years. now i hope the world is convinced of shocking speed of global warming. ", 1
"aybe you should focus on hair loss secrets instead because that is affecting you more than global warming guy! ", 0
"hina clarifies for trump: uh, no, global warming is not a chinese hoax    china clarifies", 1
"his global warming sure is getting out of control, the celebrities, the pope, and obama are right, it's ho", 1
"from children are most vulnerable to climate chang", 1
" think is buying on the gullibility of canadians regarding climate change", -1
"h yeah there's no climate change *sits through day 5076 of rain with no forecast end in sight", 1
"otta be global warming. they need some excuse", 0
"ilary should appoint barak and matt to handle climate change", 0
"arbon engineers? what bison in south dakota can teach us about fighting climate change.  ", 1
" simple question all climate change deniers must answer. what if your wrong.  #auspol #climatechang", 1
"o you're down with him denying climate change is real &amp; wants to stop funding un climate change efforts? #makessens", 1
"e all know climate change is real your dumbass. it's called the ebb and flow of mother nature. go read a book you hac", -1
"ound up of un #humanrights treaty bodies' conclusions &amp; recommendations on climate change, includ/ protection of p ", 1
" man who rejects settled science on climate change should not lead the epa ", 1
"ill de blasio, the mayor of new york explains why the city is moving on climate change. #thisisleadership ", 1
"there is sience to back that climate change is a hoax, but political correctness can't abide by that", -1
"rapped in arctic ice for thousands of years, climate change could soon release 32 million gallons of deadly mercur ", 1
"ecause the backlash against their hectoring will make it harder for climate change measures to become popular", 0
"his morning hannah decided to take bold action to protect her future from catastrophic climate change. now police ", 1
"an we spin it to include climate change also", 0
"climatechange bringing republicans to the climate change table: then there are republicans l...  #tcot #uniteblu", 1
"he european union (eu) is taking action to fight climate change. watch video to learn more. #climadiplo ", 1
"es, there is an red 2.... the climate change act would imply more renewables ", 1
"he sea floor is sinking under the weight of climate change ", 1
"arliamo del tempo  udine. clima e global warming sono i temi attorno a cui la comunit scientifica... ", 0
"ig picture, i know global warming is terrible &amp; there are a ton of consequences that stem from it, but small pictu ", 1
"houghts on climate change, terror and the intersection between the two. the frog and the iceberg - a week in paris ", 1
" thought that 100% of climate change scientists believed in climate change", 0
"ore aviation fuel burned impacting the climate change hoa", -1
"o many people posting about standing rock, alt-right &amp; climate change. eyes are being opened ", 1
"ow the coffee industry is about to get roasted by climate change  ", 1
"ruitt can go to congress anytime he wants to ask for more clear authority to fight climate change. #epa #altgov ", 1
" go, girl!! we expect this crazy weather, but the whole country has gone crazy! guess its that global warming", 0
"akistan is the top of the country who's effected by climate change ", 1
"lease watch,tweet our climate change impact video  help us reach 1 million people", 1
"ad news for coffee drinkers: climate change may negatively impact the quality of coffee. ", 1
"n other non-crazy news. this is what global warming looks like, unstable weather. unpredictable weather. extreme w ", 1
"ereka, borjuis, dengan konsumsi tumpah ruah, mobil pribadi dengan ac dingin, kamar dingin, mungkin tdk trll mrskn efek climate change", 0
"hhh, climate change during a republican debate... this should be interesting. #gopdebat", 0
"ecause the fake science of climate change told us we'd all be dead by now", -1
"kay, scott: when should we talk about climate change? on the 13th of never", 1
"o why did we have huge storms before your so called global warming", -1
"n a side event at cop 21 about climate change communication. angelique kidjo emphasizes $q$we need to connect cc to people$q$s reality.$q", 1
"wo days ago it was 60+ degrees and today it's snowing but somehow there are still people that don't believe in climate change", 1
"inters like these make me think that global warming is fak", 0
"ols would rather try &amp; scare up 51% support for punitive climate change responses than build 70% coalitions for lo ", 1
"or global warming to be a worsening trend all over the world is very concerning! how does the trump administration explain it", 1
"pls publicly oppose dup views on abortion, same-sex-marriage + climate change #dupdea", 1
"oys are to feelings as statesboro is to climate change   - a compariso", 0
"ight on so many levels on her take on the importance of the climate change talks", 1
"e: hurricanes, floods, and other clear climate change events. may be time for buckminster fuller domes...(tho' ear ", 1
"ome on now: scientists say apocalyptic predictions about global warming by the u.n. are not credible ", 0
" just joined in combating climate change. take action #beforetheflood ", 1
"obby jindal insists we ignore climate change, new orleans&amp;#039; gravest threat ... - bayoubuzz ", 0
"inally, you are not a lone voice in the media. and you have the daily mail to thank! ", 0
"ow about this: is global warming favorable on unfavorable thermodynamically? justify your answer", 0
"omply doe! you work for #wethepeopleu.s. energy department balks at trump request for names on climate change ", -1
"or starters, diesel-electric hybrid tractors (akin to a prius) are on the market. misleading headline. #cdnpoli  ", 0
"rominent scientists say climate change fanatics are irrational ", -1
"he colorado river is shrinking because of #climate change  #environment ", 1
"eterans urge the white house to stand by our fight against climate change as senior advisers debate exiting the... ", 1
"s it bad that i feel more threatened by jeff bezos than climate chang", 0
"ead | how climate change affects asean affairs | via  #climateactionp", 1
"appy november the high temperature is still in the 80s global warming is real and the natural progression of time means nothin", 1
"he trees are so confused. we have both dead leaves and buds on the same trees in november, but what climate change", 1
"ll in the face of catastrophic climate change..", 1
"t's an op ed saying nothing is certain and life is complex and one example is climate change . the piece is largely not about c", 0
"n other shocking news, climate scientists are worried about global warming, kylo ren is worried that nobody takes ", 0
"ad how some people think global warming has nothing to do with any type of extreme climate chang", 1
"ard-working miners are losing jobs b/c of senseless 'global warming' policies by our big govt bureaucrats. good protest", -1
"hout out to the idiots that deny climate change. it's december 6th in the northeast and i should be covered in sno ", 1
"trategy to avoid climate change in your business ", 1
"f you're looking for good news about climate change, this is about the best there is right now - washington post  ", 1
"m on (..climate change/global wrmng, whther more,fewr, r same # $q$s, as sea lvl rises strm surge is going 2do evn more damage", 0
"t sucks and climate change is real but this is typical for lousy smarch. #dlw", 1
"hat climate change story you've always wanted to tell?  now's the time. #climateaction film contest. ", 1
"3novices : oceanographic training centre getting ready oceans play a big role in studying climate change and weather forecasting patterns", 1
"s climate change just a hoax? who knows", 0
"fter a horrendous hurricane season it's time to think about man induced co2 as a cause of global warming. here in ohio we just had one of.", 1
"eeping the holiday tradition of ruining christmas twitter by reminding everyone that global warming is rea", 1
"&amp; i have been talking about climate change in the second period. that's what kind of game we have tonight", 0
"imagine how cold it would be without global warming", 0
"his father of global warming  seems to agree that it's not anthropogenic. if it is, what ca ", -1
"amaphosa speaks of the real effects of climate change in davo", 1
" predicted global warming", 0
"s they grapple with unempt, no pensions, crap healthcare, war, climate change, they'll be appalled she didn' ", 1
"ol facts. but also 'global warming isn't just a bunch of hot air'  unless you're in sudan of course.", 1
"ell congress: irma is a climate change disaster ", 1
"hanks to climate change, the weather roasting california and freezing the east may thrive ", 1
"o amazing! lets just increase global warming, kill jobs/employment and make sure your future kids lay in bed all ", 0
"o one believes that. we're sure the talk is trade, climate change, etc. you should be too busy to tweet ! ", 0
"oters in ca-04! roza calderon is a scientist who will fight climate change, a single mother who supports medicare ", 1
"ho leads the world in the fight against climate change? ..  #climatechang", 1
"adical thoughts on how climate change may impact health ", 1
" think because he knows climate change is bogu", -1
"ost something insightful about global warming again", 0
"romised for my vote that climate change was junk science. now he's talking to al gore? oh hell no!! not what i voted for", -1
"lobal warming exists only on a small slice of beachfront property in ireland owned by donald trump ", 1
"elp, al, help!! --al gore reaches out to work with donald trump on climate change ", 1
"limate change is real, but the cause are not humans. the cause may be outside our solar system.. other planets are heating also.. #planet", -1
"q$do you have evidence that it increases by 50%?$q$  $q$like, it$q$s the earth. how are you? it$q$s climate change$q$ ", 0
"t least obama isn't a christian-extremist who thinks global warming &amp; evolution are hoaxes", 1
"hat the sea wants the sea gets with climate change the arctic falls... ", 1
"limate change isn't real' 'bitch tell that to the weather", 1
"mproving climate change reporting and cooperation between science and the media on the agenda of aman meet #cyprus  ", 0
"ow can we save the world from global warming?  just blow really cold air on it from space ", 0
"or the record, i do believe climate change is real. i just dont believe the governments really wan ", 1
"r maybe global warming???? lmao ", 1
"f you haven't watched climate change documentary 'before the flood' you have to! he knows what he's fighting for!", 1
"atastrophic environmental events disproportionately affect women - as climate change worsens, women will be more b ", 1
"eautiful light projections on the tasman glacier highlight impact of climate change  video ", 1
"here is no climate change", -1
"ikas link to climate change ", 1
"obody has to 'believe in' climate change -- it's not 'the emperor's new clothes.' just read this! ", 1
"all think that the weather is crazy now but imagine in five years when global warming is wors", 1
"limate change is real however the agw side of it is undeniably over hyped. ny city is supposed to be floode", -1
"o u believe in climate chang", 0
"econd-hand clothes are indeed a force for good.  but fears that climate change threatens cotton are unfounded. ins ", 0
" truly support and respect you, but i have one issue. you can't keep denying climate change please i'm begging you", 1
"he us center is streaming a presentation on jurisdictional approaches to climate change. watch now", 0
"irector general spending some time in #rome with the pope a global advocate for climate change. ", 0
"wesome! now tell us how climate change is causing these extreme temperatures. that is what is mis ", 1
"hat company doesn't believe in climate change. they're one of the biggest opponents of any us climate change polic", 1
"hatvwould be global warming...i am not being tongue in cheek but change in enviroment.", 0
"lobal warming", 0
"enying climate change is like denying that lettuce is green. you can be uneducated or stupid, but are you blind too?", 1
"ince climate change now affects us all, we have to develop a sense of oneness of humanity'. -dalai lama ", 1
"uiz: how could climate change destroy world heritage sites?  #climatechang", 1
"rump wants global warming to show us its birth certificate", 0
"he smoke from the north georgia wild fires has made it into atlanta... scary. no climate change to here see, nope..", 1
"lanet succumbs to global climate change from greenhouse gas emissions? the answer is no so enjoying your life here on earth while you", -1
"reat reply to a stupid question brit. leave it to the climate change goons", -1
"lashback 2004: the pentagon (allegedly) tells bush: climate change will destroy us ", 0
"eostorm is an contamination climate change a problem. its well-nigh as whether the senescence and away of handle ", 1
"nd thinks climate change is a hoa", 0
"alling for expressions of interest myanmar climate change alliance (mcca) is jointly implemented by the united... ", 0
"anson visits reef to dispute climate change.  senator pauline hanson has slippe...", 0
"retending climate change isn't happening doesn't stop it from happening ", 1
"o2 doesnt cause climate change?!?  ", 1
"oo bad climate change doesn't care", 1
" things you can do to stop donald trump from making climate change worse. ", 1
"warm weather in january*: global warming is gonna kill all of us  *cold weather in january*: this cold is so an ", 0
"uck does climate change have to do with radical islam? syrian refugees? do you need an adult? ", -1
"our mcm thinks climate change is a hoax", 0
"ant to develop your skills in communicating climate change? don't miss our free interactive workshop!", 1
"$q$m going to be honest, the issue i$q$ve most looked forward to is climate change and alternative energy", 1
"id he box him for approving taking down all global warming related info from gov pages", 0
"lose lcps this climate change making me sick and i dont wanna get anyone else sic", 0
" just joined in combating climate change. take action #beforetheflood ", 1
"'all it's the middle of november and i'm wearing a tank top but 'climate change isn't real' oka", 1
"bama claims eating steaks contributes to climate change. ", -1
"orway could be a world leader in green energy. drilling in the arctic &amp; worsening global warming is not the way", 1
"eople in carrum downs should blame burning coal for causing this climate change event. if they don't, t ", 1
"o we haven't. what an idiotic statement. humans have been constantly adjusting to climate change since the caveman. ", 0
"rom 60s and raining yesterday to 30s and snowing today, if you don't think climate change is real, please educate yourself", 1
"ew mexico suffers worse climate change than the great barrier reef", 1
"oes perry know what the doe does? he also doesn't believe in climate change.... ", 1
"-4 inches of snow my ass, global warming fucked that right up, stay woke", 0
"he climate change racket has lost force #podestaemails26 ", 0
"old weather is my time to shine and global warming is really messing that up for me", 0
"t's not global warming, but cooler temperatures are the most pervasive throughout most of us:  #climat", 0
"dmitting to climate change by insisting a wall be built", 1
"umbass racist, sexist, misogynist, lying and unqualified corn muffin who thinks climate change is a hoax", 1
"he world will end for the humans if we don't do anything about the climate change", 1
"lown preaches fear from the altar of man-made global warming:  #climat", -1
"iggas asked me what my inspiration was, i told'em global warming, you feel me? #coz", 0
"0 terrifying before and after images of climate change ", 1
"cymi: mike pence tried defending trumps lies on climate change. he didnt do well.  #debates2016 #climatevote", 1
"limate scientists, in attempts to halt global warming caused by caribou farts, have successfully trained ", 0
"e is being investigated whether exon deceived investors &amp;public by hiding what it knew link b/w fossil fuels &amp; climate chang", 1
"tuesdaythoughts do or die save humanity &amp; save  can be warriors against climate change.  ", 1
"emember when south park had an episode making fun of al gore for thinking climate change was rea", 0
"an we stop climate change by removing co2 from the air? ", 1
"pinion: hunger on the horn of africa is not caused by climate change  via", 0
"he whole climate change thing is calling us all sinners for breathing, existing. carbon ", -1
"ho gives a crap if he used an alias? man made climate change is the biggest hoax ever", -1
"pecies migrate as a result of global warming.  ps don't lick the cane toads ", 1
"onservatives probably cant be persuaded on climate change. so now what?  via", 1
" should be inside doing some article posting and worrying about global warming, as the weather is like mid-spring. ", 1
"ust my two cents on the best coping strategy for vulnerable smallholders in climate change ", 1
"awn. so are you back to global warming now or what", 0
"o climate change stuff fits in my schedule", 0
"hat does climate change have to with cia - zero just another piece of corrupt news network dishonest &amp; fake news", -1
"o nigel lawson's dodgy outfit irresponsibly downplaying global warming has links with the iea. not with any... ", 0
"bama /9/11/2001 global warming...1142 people killed on 9/11 were in direct competition with the chicago cl ", -1
"ol we talked abt reasons why ppl don't believe in climate change in class today &amp; the most common reason is ppl think its a conspirac", 1
"lobal warming game :", 0
"oure doing a disservice by having one climate change skeptic and not 97 or 98 scientists or engineers... ", 1
"urrah 4 war, climate change &amp; fascistic $q$free-trade agreements,$q$ trojan horses 4 corp. rule  ", 0
"nderrated moment in rap history: ludacris saying he's causing global warming by smoking too much weed. iconic", 0
"ntegrating 2 types of models to predict the effect of climate change on crop yields  #science #new", 1
"ook, dicksmoker, the global warming hoax is about stealing our money and freedoms. wake up you sheep and check out the real science", -1
"een sniffing that omamie butt again, huh??? ", -1
"rump: climate change is a hoax!  also trump: i propose we build a wall to keep climate change away from my golf cl ", 1
"eading the replies of people truly believing climate change is democrat propaganda  ", 1
"hot off the art desk? who is this guy? a theoretical physicist that props up the global warming hoax? ", -1
"lobal warming is as real as racism will be in the white house", 1
"atch j-cccp's 'feel the change' campaign video, launched as a part of the belize climate change communications... ", 1
"ational geographics climate change documentary with leonardo dicaprio is now on youtube  via #thenextwe", 0
"n defence of the 1.5c climate change threshold - jordan times ", 1
"avos 2018: climate change rhetoric and reality  via", 0
"ow global warming atethe nasa budget   also responsible for global warming models that have proven to be inaccurate", -1
". 'the clean energy revolution is underway' i am not optimistic about us doing enough to stop global warming without huge commitmen", 1
"ace is frozen due to global warmin", 0
"here's so much snow outside when will it stop, global warming where u a", -1
"iscussing climate change incognito. ", 0
"aking additional steps to expedite global climate change by adding import tariffs on solar panels ", 0
"prove you're a decent person. please publicly oppose dup views on abortion, same-sex-marriage + climate change #dupdea", 1
" clicked to stop global warming via ", 1
"he case for optimism on climate change | al gore: al gore has three questions about clim...  #ted2015 #kevinroye", 1
"hats how my teacher is about people who think global warming is fake and it is so refreshing and super awesome", 0
"arghem $q$belgie haalt klimaatdoelstellingen door boekhoudtrukje$q$. of boekhouding global warming zal stoppen, is niet vermeld. #klimaatzaa", 0
" hope you global warming assholes are happy. its fucking cold again", -1
"o climate change than grain-fed. they require much more space and live for longer per cow &amp; are smaller", 0
"1) there is no such thing as global warming. chuck norris was cold, so he turned the sun up", 0
"hip made a voyage that would not have happened without global warming  ", 1
"igger, faster avalanches, triggered by #climate change #auspol #tippingpoint ", 1
"lobal warming brain (psychedelic electronica) boogie underground ", 0
"nd so now i'm burning a tire in my back yard. sending smoke signal 'man made climate change is merely a tax.", -1
"mnesty&amp;greenpeace: with impacts of climate change, the risk of displacement may reach catastrophic proportions.' ", 1
"'d look into a lot of scientists estimate earth can't sustain 4 years of climate change denial. scary shi", 1
"ign to restore &amp; maintain accurate science-based info on climate change to the white house website ", 1
"etweeted washington post ( opinion: phoenix heat, tropical storm cindy show how climate change... ", 1
"retty sure mayor stothert is praying for enough global warming that it never snows in omaha again, because every time it snows city shut", 0
"video] bill nye offers climate change skeptic $20,000 bet...  ", 0
" think it's the fact climate change isn't simple confuses and angers the stupi", 1
" wonder what will do about climate change. hope he has lots of money to pay for lawyers! oops! ", 1
"ew images show 50 years of climate change in the himalayas ", 1
