"co terrorist: im just more afraid of climate change than i am of prison. that, my friends, is the mentality we' ", 0
"ommentary: with talk of mini ice age, global warming debate may again be about to change  via", -1
"lobal warmin", 0
"othing says global warming like being snowed i", -1
"epublicans be like: 'i don't believe in climate change and here's why' *links an article from a denier website with 0 scientific accuracy", 1
"lobal warmin", 0
"nsight: to deal with global warming  we need many of the same things that are absolutely necessary to explore space 1/", 1
"ociety saves $6 for every dollar spent on climate change resilience  via", 1
"amn global warming", 0
"uilding a wall is obv more imp to most americans than climate change x", 1
"mondays eclipse be a call to action on climate change: ", 1
"itting outside enjoying the sun then remembered it's february and now all i can think is global warmin", 0
"e now know what killed all those saiga, and it was connected to climate change:  #saiga #climatechang", 1
"hy global warming is like a scorching dinner  #science;", 1
"ali's 'endless global warming' drought over? how? storms are making a dent in california's drought; 7 feet of snow ", 0
"oogle just notched a big victory in the fight against climate change  via cnbctec", 1
"bbc news: six graphics that explain climate change ", 1
"ew york 2014 - buried treasure, global warming, corporate espionage, plucky kids, love, action, community &amp; a plan to end late capitalism", 0
"ays the person recieving checks from climate change lobbyists ", -1
"k, let's do say this again: overwhelming evidence shows co2 emissions are dominant factor driving climate change ", 1
"histleblower admits scientists manipulated data, making global warming seem worse to help obama  ", -1
"sk a scientist from binghamton university: can we overcome global warming? ", 1
"he billionaire's guide to surviving global warming  with ian the climate denialist potato | first dog on the moon ", 1
"orst defense of climate change skepticism ever  and yes, he is on the transition team #godhelpu", 1
"hy do we have to make a deal to do our part for climate change? why can't everyone just do their part for our planet", 0
"robably the scariest thing you'll watch this halloween. leonardo di caprio's climate change documentary ", 1
"uck this guy and his fake climate change policy. disgusted with obama ", -1
"etweet if you agree climate change", 0
" had to mention global warming....oops climate change didn't ya......climate has always changed. #bbcclimatebias #bbcbia", -1
"ow much can bicycling help fight climate change? a lot, if cities try  streetsblog new york (blog) ", 1
"he physics of carbon dioxide causing climate change is very basi ", 1
"trump veers off script on climate change.' it's just one reversal after another. alt right are suckers. trump = obama 2.", -1
"his is interesting. trying to rt the pics of climate change and it won't let me. ", 0
"rotect america's border from climate change ", 1
"limate change is about economics too. how will climate change impact future floods and flood insurance? ", 1
"rt where are all the climate change songs?: the one big thing there$q$s never been a hit single about  #follo", 0
"arry is trying to come up with a chorus about the dangers of global warming eventuall", 0
"griculture victim of and solution to climate change ", 1
"veryone seems to be quick to forget that the marginalized face the harshest repercussions of climate chang", 1
"ow do you talk to people about climate change? researchers found that some messages are more effective than others", 1
"ctually pm modi has written book on climate change ", 0
"t's important to understand that unknown factors triggered by climate change will have a significant effect in fut ", 1
"his is the real reason for global warming, and the science is irrefutable. i'm sorry, i don't make the rules. ", 1
"old's gone, many other minerals almost gone, we've restricted ~1/2 of sought import hardwoods and china's now planting for climate change", 0
"eminar on global climate change ", 0
"hese climate change fanatics harp on about melting ice in the arctic but never mention it's increa ", -1
"hy do some people still doubt global warming?  ", 1
"p to 18 inches of global warming to dump on nyc ", -1
"he earth would be heading for an ice age, but global warming driven by humans have n ", 1
"e better get use to climate change when he goes to hell. ", 1
"ebel media: so who are the scientists who$q$ll be advising trudeau, premiers on climate change?  #tcot #tlot #tgd", -1
"kay go ahead and leave your coats at home you won't need em it's a global warming paradise out her", 0
"hough gallingly, one of the world's largest governments denies climate change ", 1
"he perfect gift for someone who might be extraordinarily affected by global warming... ", 1
"eckoning with climate change will demand ugly tradeoffs from environmentalists  and everyone else - vox ", 1
"f your hair is becoming white and crusty and your skin is turning orange...global warming is probably a thing", 1
"eaning the climate change pact likely has massive kickbacks for chin", 0
"his is why we need global warmin", 0
"ecause climate change is real you fucking cun", 1
"briannafruean #climatewarrior #pacificfeminist #youngleader speaks of the impacts of climate change &amp; urges us all ", 1
"ow can man say we can stop global warming by putting our ac outsid", 0
"lease help inform others about climate change - thank you - rich #stayinformedcc #hope7cc ", 1
"nstead of spending billions on trumped up claim re global warming why not prepare for epic cme r emp which could be real #foxnewsspecialis", -1
"limate change is not about climate, about control, pls understand nothing is what it appears, grow ", -1
" think we need to acknowledge that if we want to be honest about climate change. #fftf1", 1
"f you believe global warming is a hoax &amp; obama is a muslim despite the facts *right under your nose* of c ", 1
"arbon pricing key to implementing paris climate change agreement  via", 1
"ore dangerous bushfires in our future if we don$q$t take action on climate change ", 1
"ou can thank climate change for adding delicious mercury to your seafood. ", 1
"t could happen ", 1
"t's twelve in the am, it's bloody hot  as shit, i can't go to sleep and now it's fucking raining! brought to you by global warming", 1
"aid. best hope #climate change is man made! so we can fix it with #sustainable #renewables ", 1
"t$q$s global warmin", 0
"he trump regime made you apologize for the truth? you going to start tweeting about how climate change is a hoax now too", 1
"f global warming isn't real then why is my seasonal depression lasting the whole year", 0
" must-read. welcome to pleistocene park, where russian scientists want to fight climate change with woolly mammoths ", 0
"he gop absolutely believes in climate change. they just know we're fucked and are consolidating power before the coasts start to go under", 1
"aven't seen this one before. his other video  'debunking 5 climate change myths' is terrible. do you want me to respond", 0
"reat article by today on climate change and some inaction by #yqrcc and  #yq", 1
"riends voting trump: do you also not believe in global warming or do you just find other issues to be more important? genuinely curiou", 1
"limate change is nothing new...the ancients migrated out of the place we now call sahara desert (from 'eden' to sweden)", -1
"fter an hour they emerged from his office, donald's face drenched in sweat.  'so,' asked theresa, 'now do you believe in climate change?", 0
"oney, you said that istanbul was climate change, no one can take you seriously", -1
" stories to read this weekend - news editors' picks doesn't believe n climate change sad 4 us ", 1
"he #globalgoals seek to end poverty, reduce inequality &amp; tackle climate change. no one should be left behind ", 1
"ew e-book released: irins reporting on climate change and food security:  ", 0
"unning from climate change is not an option. we need to go into the empty regions and plant trees, irrigate with s ", 1
"trump choice for #epa chief is a climate change denier ", 1
"yo global warming is like actually a real thing ", 1
"bsolutely right about time and human impact on global warming. chris cuomo out in the cold", 1
"ood news: obama$q$s global warming campaign to cost $45 billion a year in regulatory costs ", 0
"rump has told many lies, climate change being a hoax by the chinese being one of them  he also said his wall would ", 1
"'all can thank me later. i think i just solved the biggest problem in the universe.  i'm not talking about global warming, terror, hollo", 0
"rotip: if you look out your windows, you will see that we invented the internet just in time for global warming", 0
"eality: need to improve energy efficiency, produce more from renewables. climate change isn$q$t negotiating w/ u", 1
"hey asked me what my inspiration was, i told them global warming", 0
"arge beetles are shrinking, thanks to climate change ", 1
"atest update from global warming. ", -1
"his is crazy, but we actually have good news about climate change  via", 1
"razy weather in nashville! going to be 1 degree tonight!! so much for global warming. am i right", 0
"he planet just had its hottest 4 years in recorded history. trump is dismantling efforts to fight climate change. ", 1
"y biggest fear with trump is climate change. we *need* to make congress blue in 2018", 1
"7% of climate scientists say climate change is real. if 97 doctors out of 100 said you have cancer would you believe the 3 that didn't", 1
" guess we can lay this whole 'global warming' nonsense to bed then, right? #satir", 1
"hy is climate change so difficult to understand? what are they afraid they're going to find out if they continue research", 0
"tate of fear by michael crichton is good about global warmin", -1
"o what i'm saying is, i believe that anti union folks are not racist, alt right, climate change deniers. but you should not trust the", 1
"lame climate change ", -1
"ombating climate change is way more important than protecting damaging job", 1
"limate chang", 0
"ut according to #trump there is no climate change nor problem whatsoever ... #keepdreaming #houstonflood ", 1
"his whole winter weather debacle is only further proof that going with the name 'global warming' was a very poor branding decision. #pdxts", 0
"f global warming isnt really... why did club penguin shut down? explain trump", 0
"he sea floor is sinking under the weight of climate change ", 1
"ere's my essay on how 'the snowman' reflects the early 21st century fear of climate in the context of mass climate chang", 0
"ho says climate change doesn't have poetic justice? ", 1
"acts don't matter? the fact that climate change is happening will one day matter to the people who ", 1
"lear proof these people dont have even the vaguest understanding of what climate change is", 1
"o you approve of the executive order is due to sign re climate change and the environment?  ", 0
"ere's a fact, all the predictive models of the last 40 yrs based on global warming have been wrong. ", -1
"limate change is getting worst n we r not bothered.killing ourselves silently. 11 killed 45 injured :(  #islamaba", 1
"000 head of csiro said all 5 computer models had failed on global warming, not even a 1c rise 200", -1
"f climate change is a myth, why all the effort to quash discussion?  ", 1
"globalwarming #earth  global warming coming faster and harder than we think:  #science ", 1
"ext ten years critical for achieving climate change goals - 2017 via /r/worldnews ", 1
"pq ideas: how will climate change alter the way we grow food? ", 1
"hat happened to al gore's pathetic 'global warming'?!", -1
"errifying effects of climate change #climate #environment #globalwarming ", 1
"uy on baggage thinks climate change is a conspiracy guy: why is it so cold?? other guy: youre a dumbass :l  marry the other guy come o", 1
"o say that president trump's position on climate change is pathetic is a huge understatement. #theresistance #sensanders #resistinghat", 1
"o you support this science which is just as real as climate change. you are some special hypocrite. #impeachtrum", 1
"ow would of thought he would grow up to be an advocate for climate change, global warming crap!!", -1
"limate change is a trojan horse to destroy the western way of life&amp; take us back to the stone ages ", -1
"itcoin a threat to global warming?   ", 1
"nline course on climate change qn 6 seems to having a problem", 0
"aybe global warming is messing up its sleep cycle. ", 0
"e are screwed if we dont stop climate chang", 1
"uck global warmin", 0
"hat's what may happen to arctic #peatlands in times of climate change with melting ice shields and rising temperat ", 1
"n excellent lecture at the royal society about the difference between climate change deniers (of which there are  ", 1
"y next car will be a hybrid &amp; i$q$m lowering my intake of beef &amp; seafood. cattle is a huge contributor to climate change &amp; oceans are dying", 1
"nd according to climate change is just a hoax! what a fucking moron!!!", 1
"oils help to combat and adapt to climate change by playing a key role in the carbon cycle  via", 1
"t snowed two times this year and once 13 years ago. the last time it snowed before that was 1895... global warming is very rea", 1
"e hear a lot about coal and climate change. what about greenhouse gas emissions from intensive animal ag? #climatechange #environmen", 1
"ice to see the issue of climate change is being addressed by the government..... ", 1
"ernie sanders, preaching the truth! listen up, people. #bernie2016  ", 1
"inistry of truth doublespeak: us federal department is censoring use of term 'climate change' ", 1
"'ve often thought that water shortage will get us before climate change can.", 1
"shamelessly manipulated*: the scandal of fiddled global warming data  #climatescam #greenscam #teaparty #tcot #pjne", -1
"xcellent! - islamic climate change - ", 0
"et if you're interested in climate change, science exploration, mental health and equal ri ", 1
"dont let our kids face climate change disaster! #parisagreement #cleanpowerplan #savetheepa #actonclimate #swingdis", 1
"o more talk on climate change? this election is rigged!! ", 1
"wow! ikaw na. ", 0
"e need to win the climate change 'war!' if we don't we are all in terrible trouble", 1
"he battle over climate changecontinues  ", 1
"magine actually not believing in climate change even china believes in climate chang", 1
"f i ever did a ted talk, my topic would be about either dealing with social anxiety or how fashion contributes to climate change", 0
"nd nowadays climate change is as questionable as the theory of gravity", 1
"ou are a complete idiot climate barbie. and a crook. there is no climate change - it is ", -1
" clicked to stop global warming ", 1
"lobal warming is definitely real nigga stepped outside &amp; instantly started bakin", 0
"ive: president obama is fighting to realize their own political gaindon't be the push to vote on the power of climate chang", 0
"o you understand environmentalists are -directly- responsible for climate change because ", -1
"lobal warming is for real..i also thot never in my life time..but now its here !", 1
"hicago, mid-november, 72 degrees outside.  until a polar bear writes me a heartfelt letter, i'm gonna enjoy the hell out of global warming", 0
"otal dem bull shit thete is no man made global climate change, &amp; nothing that californians can do. ", -1
" haven't forgotten that helped elect trump by giving voice to climate change deniers and other conspiracy the ", 1
"hy you should avoid listening to climate change denying scientists. example one. ", 1
"arsh winters in mexico caused by global warming  ", 1
"rump's energy policy includes scrapping obama's climate change efforts and reviving coal. #climatechange ", 0
"rought in southern africa points to urgent need for climate change plans ", 1
"his is awesome. thank you #mars the world's largest chocolate maker pledges $1 billion to fight climate change ", 1
"ard to know with all this dang climate change. we'll both get a hurricane, probably. a hurricane in kc", 1
"890m eu package to help 79 developing nations combat climate change  #eusupport #acp #climateactio", 1
"he problem with donald trump's stance on global warming - ", 1
"ell trampclimate change will kill his golf courses! (it actually will). meanwhile: #impeachtrumppence  #theresistanc", 1
"n areas warmed by climate change, 99% of baby sea turtles are now female, which could lead to extinction later on: ", 1
"erafied: rt therickydavila: al franken shutting down rick perry over climate change is everything &amp; more. ", 1
"green #news reckoning with climate change will demand ugly tradeoffs from envi  see more ", 1
"an you name me one thing that was because of $q$global warming$q$ i$q$m sorry i mean climate chang", -1
"limate change: why you should pay attention to the cop21 summit in paris - cnn -    cnn  ..", 1
"ow. ", 0
"ome on ann, we all know global warming is simply the result of all the baby boomers going through hot flashes at the same time", 0
"ighlighting the impact of climate change, drowning world focuses on the effects of flooding on every day lives. ", 1
"ets go green stop global warmin", 1
"re they assuming the outer banks will be gone due to global warming? ", 0
"alled global warming a hoax perpetrated by the chinese' i'm wheezing pls watch this ", 1
"eckoning with #climate change will demand ugly tradeoffs from environmentalists  and everyone else ", 1
"ue to climate change concerns i will not be performing at the trump inauguration.", 1
"ow to address climate change with skeptics", 1
"his is my art project to show how earth is changing because of global warming. i drew pictures of three ice cubes ", 1
"raining course on climate change concludes ", 0
"he effect of arctic climate change will have profound local, regional and global implications'. -arctic council ", 1
"e cannot blame all of climate change on the west, our activities locally also play a part' #ggiecotour ", 1
"his hypnotizing animation shows the incredible trend of global warming  via", 1
"t new north &amp; south poles flying in the sky. reverse climate change  ", 0
"ddressing climate change with city leaders who are making a difference ", 1
" hate this global warming talk. it's all so doom and gloom' -farmer i met in manitoba- ", 0
"artoon: if the media covered climate change the way it covers hillary's email ", 1
"t's a tricky one isn't it?   personally, i think anyone who claims that climate change is a chinese ", 1
"e have strong feelings about global warming and 100 demons ", 0
" beautiful writer and a light guiding the fight against climate change. may flights of angels sing him to his rest. ", 1
"egative thinking destroys your brain cells and causes global warming", 0
"ouldn$q$t agree with this more.  ", -1
"urbing climate change has a dollar value  heres how and why we measure it' ", 1
"dont let our kids face climate change disaster! #parisagreement  #cleanpowerplan #savetheepa #actonclimate #swingdis", 1
"f that's not proof of global warming then u are full of shi", 1
"e appreciate you risking your life in the global warming blizzar", 0
"mao i believe that to but not about this, if you believe global warming isn't real then you're wrong ", 1
"et me tell you my view point on global warming considering the #smog show in delhi recently.do read and spread this thread if u like it", 0
"et$q$s just blame climate change on this too. since that what really matters right? hoping people think before they vote next ti", -1
"hat's so awesome and inspiring to see the states come together despite #trump short sightedness re: climate change - it is real!!!", 1
"hat will his life be like with climate change?: how is a warming planet going to shape the life of a baby bor... ", 1
"e have gone so far with combating global warming. it is important to all of us that we have a clean env ", 1
"beforetheflood taught me more about climate change than my entire formal education!! insightful and bold!", 1
" thought climate change won't save you or your children from it", 0
"ou already are! with canadas #weathermodificationact and usas machines like #haarp we can battle #climatechange ... ", 0
"he fact that i can wear a rolled up flannel in december proves global warming is rea", 1
"ixtape prediction: ended world hunger, violence, climate change, resolved every war/conflicts between cou ", 0
"his does not mean that climate change is not real. just winter in #alaska ", 1
"ow tf can you deny climate change. it's literally scientific fac", 1
"ourists banned from hiking on new zealand$q$s glaciers  fox and franz josef because the ice is melting too quickly from global warming..", 1
"ey does smoking weed add to global warmin", 0
"airline is receding - climate chang", 0
"opulation growth and climate change explained by hans rosling... ", 0
"s a tough climate change policy an election winning strategy", 0
"ere's a great pic of me on cbs spilling some intense tea on climate change and how lasers might have the potential ", 0
"o, google maps is not trying to make a point about climate change ", 0
"ear modi ji, to talk abt climate change kindly make it mandatory for every state n every vacant ", 1
"ew cba case a warning: step up on climate change, or well see you in court | john hewson ", 1
"atch: bill nye blows gasket when a real scientist schools him on facts about climate change  lmao!!!!! ", -1
"ust because a group of scientists with a vested interest in man- made climate change say something, doesn't make it fact! sad! #qand", -1
"eems to be weather is upside down due to climate change keep safe and warm ", 1
"verytime i tell an adult i'm going into the environmental science field they start telling me how climate change isn't real.", 1
"limate change negatively affecting agriculture:  ", 1
"ound u  ", 0
"m not worried about my homework or that i dont have a winterfest dress yet....im worried that climate change is ", 1
"bd climate change lectures leave public unmoved: drawing out our innate ties with nature may sway opinion mor... ", 1
"hy do people lie about climate change? ", 0
"any people thought, 'how could the head of epa say climate change is not a part of our mission?'' ", 1
"m creating a think tank for independent thinkers to solve climate change, would you post also at ", 1
"esde codex: #dyk how climate change is influencing #foodsafety? salmonella spreads due to extreme heat and precipitations events #parisag", 1
"ahaha. maka lagot. nagpa check up ko. either sa climate change daw or anxiety.", 0
"lobal warming nyc ", 0
"aradise burned: how climate change is scorching california ", 1
"ow to address climate change: cut holidays, sell the car and don't have as many children, say scientists ", 1
"lobal climate change to be ignored in order to give temporary support to racist conman and putin puppe", 1
"so are these trails contributing to climate change, or are they 'geoengineering', which is supposed to combat it", 0
"limate change and $q$#gameofthrones$q$: if the wall melted, would westeros drown? #gameofthrones ", 0
"he sea floor is sinking under the weight of climate change ", 1
"hat global warming sucks..", 0
"adly my parents are those people who think climate change isn't a problem and voted for trum", 1
"do as i say but not as i do' seems to be the theme for these climate change lovers #gore #mattdamo", -1
"histle blower-noaa scientists cooked climate change books, gets zero coverage by liberal media- still think theirs isn't fake news", -1
"local communities are on the frontline of climate change. now there is an affordable program designed to help! ", 1
"o matter what we do or don't do with respect to climate change, food systems of 21st century will radically transform' vermeulen #gaid201", 1
"hy have you forbid our scientists to talk about climate change? why remove water regulations? do ", 1
" suppose the next step is to queue up an inspirational song, change my profile pic to a union jack  &amp; blame global warming. #londonbridg", 0
"mao our president doesn't believe in climate change soo ", 1
"port must prepare for irreversible changes due to climate change unless it becomes part of the solution. #climate ", 1
"lashback: abc predicted in $q$08 that nyc would be under water from climate change by june 2015 ", -1
"ll women have vaginas.... to coin a favorite liberal global warming phrase... it's called science", -1
" foods that could go extinct thanks to climate change  via", 1
"rump's first pick for 'environmental issues' is a person who proudly admits they're a climate change denier", 1
"here is dire need of adaptation &amp; mitigation-can help to reduce the risks of climate change to nature &amp; society #climatecounts #cop2", 1
"umans have a choice: die of apocalyptic climate change or die in tech wars", 1
"science reveals pluto  (why cant we trust it on climate change)? #headlinesap", 0
"on't fall for global warming -&gt;what's going on between ivanka trump &amp; global warming guru gore? ", -1
"attle farming is the # 1 cause for global warming, we don$q$t need meat to survive.  ", 1
"heck out the new documentary at youtube channel: before the flood. on climate change, with ", 1
"y two cents on the global political leadership on climate change in a trump era ", 1
"aking the environment great again...trump's environment chief says co2 not main cause of global warming ", 0
"limate change doesn't exist", -1
"f we want to address climate change &amp; u.s. competitiveness, we need to work with the rest of the world, not turn them away", 1
"hat will be super fun amidst a global population boom to 9 billion, a global food shortage, and climate change. hooray", 1
