"he latest the climate change daily!  thanks to #climat", 0
"lorious leader action on climate change thoughtcrime double plus good. ", 1
"lah blah, steve bannon is pro-facts lol he doesn't believe in climate change. he's a fucking halfwit bigot ", 1
"t what if we simply stopped making transportation investments that make climate change worse? ", 1
" sent him my essay on sea level rise/ climate change for a class assignment and it would be awesome to get feedbac", 0
" just joined in combating climate change. take action #beforetheflood ", 1
"rump says nobody really knows if climate change is real - the washington post  error on safety side doesn't hurt! ", 1
"ooks like i willbe seeing my shadow shortly. 6 more weeks of winter. but we have global warming to help is ou", 0
"fallacy' has nothing to do with the science of climate change. belief is not required, evide ", 1
"report  concerned scientists warn us about #killerpalm oil &amp; global warming ", 1
"ey climate change goal may be missed:  (via #actonclimat", 1
"arry is trying to come up with a chorus about the dangers of global warming every single da", 0
"ave water,grow tree than less global warmin", 1
"ew zealand could become the first country in the world to recognize climate change as a valid reason to be granted residency", 1
"t's weird how we keep seeing consequences to that imaginary climate change thing. ", 1
"o, the worst-case climate change futures havent been ruled out  ", 1
"cience &amp; research cannot be disappeared. this is not just dangerous- treasonous. military says climate change=threa", 1
"ore's climate change followers send a clear message to trump, and that message is: 'there aren't very many of us.' ", -1
"oliticians warn about  global warming &amp; vow to combat w/ even more absurd fantasies about immediately de-carbonizing economy!", -1
"o, bill nye is not debating sarah palin on climate change #nye ", 0
" find it very fascinating (and a bit frightening too). i learned about it when teaching climate change last year.", 0
"hat moment when china is actually becoming world leader on fighting climate change bc they don't think 'god' will ", 1
"hy are u denying 99% of scientists? none of them says the hurricanes are result of global warmin", 0
" swear i will never scoff at global warming again, please just let the temperature fall below 6", 1
"he worst summer pests are on the rise due to global warming:   v", 1
"n its 100th birthday in 1959, edward teller warned the oil industry about global warming  #globalwarming #history ", 0
"ot to mention trump and family who wrote a letter in 2009 urging obama to act on climate change", 1
"ou might mention that hilary clinton strongly endorses science and believes climate change is real", 1
"t's november and this is the forecast, but sure climate change is a hoax  ", 1
"ore liberal hypocrisy.  cite 'science' when it comes to climate change, but deny biology when it comes to conception &amp; gende", -1
"rom the economist espresso: hot, unbothered: global warming ", 0
"his is how it's done, not toadying to trump, bill gates &amp; investors worth $170 b launch fund to fight climate change", 1
"ind out what is true and false about climate change ", 0
"ffshore wind, clever concrete and fake meat: the top climate change innovations!  ", 1
"oogle earth's timelapse update illustrates 30 years of climate change ", 1
"f you ever want to see global warming in action come to nc, we go from 80 to hailstorms faster than trump can say chin", 1
"t was colder in atlanta georgia today than in anchorage alaska.......but there is no climate change because republ ", 1
"indings may help scientists understand how much carbon dioxide can be released while still limiting global warming ", 1
"ot only stronger &amp; more frequent, but harder to predict their path - but global warming can't be t ", 0
"ranslation: i'll believe global warming when all of humanity (not just some) faces extinction du ", 1
"ip: weather channel founder john coleman dies - called 'global warming' a 'hoax'  via", -1
"umagin bigla tanginang climate chang", 0
"ear sir,world needs to fight global warming,people needs their basic needs  find out a path where needs of both is met", 1
"u. make smarter choices as a consumer to combat climate change.'  #climatechange ", 1
"he global warming struggle is real", 1
"ntil global warming becomes the answer to all the solutions of our problem what i write will live foreve", 1
"ey! we have a new board for bouncing ideas on climate change, are you interested? ", 1
"ow nature and people, including human-induced climate change, alter the pathways of wate", 1
"emember, our discussions on climate change are _also_ discussions about devastating nuclear waste ", 1
"hina rolls its eyes at trump over his ridiculous climate change claim  ", 1
"'m angry that we're not addressing climate change, and are destroying the precious earth  in the name of corporate profits", 1
"omorrow stadium . walk against climate change #lwtzewalk2015 cc ", 1
"ou got to be kidding, the nyt, this is suppose to be legit, so fake, they have climate change wrong", 0
"5 degrees in stl on last day in october. i am all for this global warming hoax", 0
"limate change is wealth distribution, is a vehicle to suck up as much money as possible. refugees crisis in eu too", -1
"his is insane. climate change and global warming are real, every child knows this", 1
"f you really sit here and try to say climate change isnt real youre completely discrediting ", 1
"rump would have us believe climate change is brought to us by the tooth fairy on santa's clause's sleigh ", 1
"ass so lit caused global warming", 0
"erious q: if gop believes climate change isn't real why need 'clean' coal? if humans can't impact enviro why need coal to be 'clean'", 0
"hank god 4 artic air. but isnt wild how they got a road there now. due to global warmin", 0
"ame 1 world series (in la): 103 degrees.  game 6 world series (in la): 67 degrees. nope climate change isn't real", 1
"t's groundhog day 2018 and people still accept weather forecasts from a rodent but deny climate change from the scientific communit", 1
"lobal warming is a natural phenomena...if it weren't, we'd still be covered in ic", -1
"oing to start blaming bayesians for global warming", 0
"hat happened to global warming? climates change every day", -1
"he funniest thing in the world is a liberal who believes in climate change......and smokes (anything).", -1
"'m all for clean air but global warming is a load of crap there has been little change in temp  in the last 20 yr", -1
"mm well apparently it didnt do well enough because the midwest and east coast needs some global warming so explain tha", 0
"ike global warming", 0
"ustralian coastline glows in the dark in sinister sign of climate change: eerie scenes in tasmania show ", 1
"reaking:: global warming wackos figure out how to move the earths around the sun. ya ", -1
" 200-yr-old climate calamity can help understand todays global warming ", 1
"ransport and climate change  #breakingnews ", 0
"o tum ho global warming ki waja ", 0
"ell drop climate change denier rebekah mercer. sign now:  via #standupforscienc", 1
"o your saying the temp is trending down then...? so sci has declared an end to global warming - whooo -good to he ", -1
"aby, it$q$s cold outside (therefore global warming doesn$q$t exist) #gopsongs", 0
"t s/n b a crime 2 discuss global warming strategies bc u don't believe they exist! obama &amp; libs want it 2 b, but i ", -1
"he entire reason you don't believe in global warming is that the oil companies spent so much to lie to you about it", 1
"xactly! it's address climate change or slowly kill ourselve", 1
"he new bill nye show's first episode was about global warming and i can't believe the liberals brainwashed him too", -1
"unton/weindorf explore climate change...villages in alaska. worth a view regardless of stance on cc. making an impact!", 1
"akes 2 seconds. poll: what do you think of trump's executive order on climate change?  ", 0
"breich: i'm often told that climate change is a middle-class issue, and the poor care more about jobs and wages.  ", 0
"t's 2f here in indy where is global warming you promised us it's cold right no", 0
"uestion 1: do u like smoking weed? 2: do you hate paying taxes? 3: do you think global warming is just a big ol ho ", 0
"till here, donnie! ", 0
" mean i would put a plug in for global warming but i have to remember we made that up", -1
"his is a really good read actually - taught me how to frame and explain climate change much better! ", 1
"ell if you voted jill, how's climate change going for ya among other t ", 1
"hreats climate action, but some states vow to fight climate change since trump won't  #actonclimat", 1
"hat if everyone in the world who wants to see action on climate change stops work the first monday of every month? #auspo", 1
"ees-mogg is climate change denier with fracking links,add leadsom,johnson,farage,murdoch,dacre,desmond etc,rush 2 tear up reg", 1
"ensanders: new: environmentalist billmckibben talks about the movement to combat climate change on the bernie san ", 1
"he same people who want us to take their 'sky is falling' warnings about 'climate change' seriously talk about 'imaginary heartbeats.'", -1
"ell according to our lord and savoir trump, global warming doesn't exist.  and since we always know trump is right ", 1
"es he is supporting climate change", 0
"hey think they can make americans eat less to reverse climate change. what?? #cosproject #marklevin #maga #tcot ", -1
" thought we just had to worry about climate change ??", 0
"climate chang", 0
"orry pop-science celebrities, but if you ever referred to someone as a denier then your climate change thoughts aren't worth listening to", -1
"lveda king is a fox news talking head and a climate change denying republican, glenn ", 1
"eems only good scenario for climate change depends on science &amp; engineering finding something new while we reduce greenhouse gas productio", 1
"oung liberals will believe anything. flat earth ,illuminati, global warming..", -1
"m creating a new think tank for climate change, would you join and post your tweet also at  ", 1
"s global warming real? what do you think will happen?  yes. end of the world, perhaps ", 1
"ig coal funded this prominent climate change denier, docs reveal ", 1
"arth's rate of global warming is equal to 400.000 hiroshima bombs a day! #climatechange, it will get worse", 1
"hock: the father of global warming, james hansen, dials back alarm  #thedailybulleti", -1
"chhotisiachhai  a3) plant a tree to stop global warmin", 1
"aha! our hearts go out to those who may be effected. it's too late to reverse global warming but n ", 1
"feelthebern  ", 1
"ichael man would call black white if that helped his wacko global warming/coming ice age/climate change/we ", -1
"reenpeaceusa: removing climate change from the epa's website is 'a declaration of war.' ", 1
"lease vote 4 hillary on tuesday. she's the only 1 who can beat trump. trump will ruin the us &amp; earth (he doesn't believe in global warming", 1
"back up your man-made global warming rhetoric with hard, empirical evidence or go away", -1
"lobal warming provides a great excuse for global socialism. enlist ----&gt;  stand up today. ", -1
"e should stop #climate change, otherwise climate change will stop us - #climatechange #future #earth #mankind #environment #sustainabilit", 1
"he rothschild's are chemicly poisoning our air to create climate change so the can push another agenda make more c ", -1
"ts like saying this climate change is happening lads, theres holes in the ozone layer. lets build s ", 1
"l franken shutting down rick perry over climate change is everything &amp; more. ", 1
"et's hear more from vulnerable #women hard-hit by #climate change talks: strong message from #dcdays ", 1
"odelling shows: we can reduce climate change by changing our behaviour ", 1
" groundbreaking study outlines what you can do about climate change.  ", 1
"he sea floor is sinking under the weight of climate change ", 1
"retty sure we are about to see george blame penguin shit for global warming any minute  now.. #qand", 0
"ou bet. liked the part abt being warned off climate change; i started there (but i don't take commen ", 0
"ight. ", 0
"#design] watch our talk on climate change live from dutch design week ", 0
" still have a hard time understanding that some people do not believe climate change is a thin", 1
"overnment fakes data to change global warming results over 20 years. liars all liars for money.  ", -1
"l gore is a fraud and refuses to debate global warming ", -1
"veryone use there cars and leave electric on we want global warming it's to cold right no", 0
"rump just had to do it...stared at eclipse without glasses. scientists said not to , but they believe in climate change so must be fals", 1
"ooks like another victim of global warming and unemployment", 0
"recisely! the disease they invented is called $q$dangerous human-caused climate change$q$", -1
"actcheck: worlds biggest oil firms announce miniscule climate change fund  via", 1
"5+ us mayors refuse to enforce trump climate change order. so important to elect leaders committed to environment. ", 1
"f climate change is something you are passionate about have a look .. what active steps will you take to make a change? #vega", 1
"es yes, but what are his views on climate change", 0
"efinitely not global warming... did you know it is cold in america?", 0
"ational parks in 2050, after climate change. assuming we still have national parks by then. ", 1
"hat's global warming for you! ", 1
"election of best short climate films on our #agofstupid dvd. send yr address &amp; i$q$ll post free copy 4 yr screening   ", 0
"to understand/debate requires scientific study/data. nasa studies climate change.  ", 0
"especting first nations sovereignty. fighting petrocapitalism. standing up against climate change. get after it. #nodap", 1
"e: yay its january and its warm out!!!!!  brain: but climate change me: ", 0
"tudents are asked to watch a video by climate change doubter john coleman who presents as his credentials that he ", 0
"ne of the paradoxes of climate change is that the worlds poorest and most vulnerable people  who contribute almo ", 1
"ews from hbr the business world recognizes the tremendous threat of climate change. they need to make that perspe ", 1
"urdboys are the reason for climate change", 0
"'ll have climate change for a 1000 ale", 0
"ail, climate change is real. how we deal with it is politics. if you want to deal with ", 1
"praises rick perry for saying seawater probably causes climate change.  ", 0
"hen i came to congress, i said i wanted to be the best voice on climate change that i could be. #actonclimate ", 1
"atched politics last night and realized that republicans only care about taxes and global warming...#pett", 0
"nfortunately the global warming hysteria, as i see it, is driven by politics more than by science.  -freeman dyson .", -1
"ew report about antarctica is horrible news for global warming alarmists' ", -1
"huffingtonpost turn up the heat on climate change: well there you go again you wacky scientis...  #teamfollowbac", 0
"hen ur enjoying the nice weather but at the same time u know it's just bc of global warming ", 1
" sat next to two penn frat brothers last night at a climate change forum and the one guy was reading taylor swift/zayn malik gossip", 0
" liked a video  penn and teller global warmin", 0
"he lies told to support the anthropological global warming scam are legendary. we will ", -1
"f my tulips don't know when to bloom cause climate change has them confused &amp; they end up dying i will blame donald trum", 1
"ere comes the liberal loons there going to blame it on climate change. prayers for the people of mexico", -1
"on't forget energy conversion programs aimed at combating climate change. ;) ;", 1
"res trump why don't you tell the war mongol to stop with global warming is and worry about pissing of the russians remind they have nuke", -1
"limate change protesters are causing traffic chaos and causing car journeys to take longer? isn't this causing more pollution? ironi", 0
"oday is #worldenvironmentday! global climate change affects everyone &amp; we all must protect the world we live in. ", 1
"he climate change in our veins ", 0
"ems come up will stupid bill regarding 'fake news'.how about issues such as climate change, healthcare reform, etc. ", 1
"hat's laughable to me is people who ignore scientists who at least question climate change narratives..", -1
" also wonder how all those people who liked the 'i fucking love science' facebook page feel about climate change", 0
" think climate change is trudeaus fault as wel", 0
"his dumbass thinks that climate change is the most important thing to protect in ca. how about sanctuary cities, ", -1
"nteresting article from ies describing how building simulation can help tackle climate change. ", 1
"t is truly a new world when china warns trump against abandoning climate change deal  via", 0
"uch an ignorant thing to say! when not only is climate change proved but we can see devastating impact in oz.", 1
"gandas agriculture cant thrive beyond 1.5-degree global warming #farmingagriculture ", 1
"hat? why not blame climate change, and poor drainage for this? those people should start reading other stuff aside ", 1
"ut just like climate change &amp; cigarettes/cancer, big profit $ fights attempts 2prove harm. easier regs: ", 1
"ou forget the no climate change", 0
"bama to warn coast guard cadets global warming a national security threat  barry$q$s  ash heap of history speec", 0
"t: ed crooks: if the world is serious about curbing climate change, we need a full-scale retreat from coal ", 1
"ou cant ignore climate change and think you have an immigration policy.' ", 1
" want to see trump dispute tt there's no global warming. hey if there is, the first to go is the fishes on your pl ", 0
"here in that report they dispute climate change? if you click on the other links youll se ", 0
"h, for sure. actively dismissing climate change for 8 years is big to", 1
"agtatanim ng kabute, isinusulong bilang tugon kontra climate change  ", 0
"hey asked me what my inspiration was i told em global warmin", 0
"f the facts supported climate change alarmism, the facts *would* be enough ", -1
"lobal warmin", 0
"'m so infuriated about this global climate change", 0
"nalysis: trump's a climate change pariah  #wyko_news ", 1
"aarp 2015 reveals climate change  via", 0
"reen technology used to combat climate change  infographic: image source   scientist... ", 1
"his is how kids learn about climate change in peru. read the interview here &gt;&gt; ", 1
"eonardo dicaprio the guy un chose for global warming ain't seen often on social media he doesn't transmit std still he isn't see", 0
"ighting climate change is ridiculous. climate changes so figure out how to survive it for fuck sake", -1
"dont let our children face climate change disaster! #parisagreement  #cleanpowerplan #savetheepa #actonclimate #swingdis", 1
"hat's me!! i'm mad into climate change these days. i'm thinkin of starting a clu", 0
"e should debate things that matter- ok let's debate the lie of climate change! liberals have lost there ability to reason ", -1
"een this in christians can't afford to bury their talents on climate change ", 0
"hat evidence does he need?  #nh needs leadership not ignorance #nhpolitics ", 1
"iggas ask me what my inspiration was i told them global warmin", 0
" got an idea lets debate climate change??? or anything...", 0
"ore than 50 million years ago, when the earth experienced a series of extreme global warming events, early mammal ", 0
"onald trump on some nut shit if he think global warming not rea", 1
"0% of scientists studying climate change were paid to falsify their results - still confused ", -1
"ell me #johnsonweld voters what did u accomplish tonight for climate change? for college tuition? for the supreme court? nothin", 1
"e are all breathing a sigh of relief. can he put a word in with the big guy re climate change or maybe the looming fascism? #popefranci", 1
"! climate change should not be a partisan issue !", 1
"ewly discovered peatlands must be protected to prevent climate change -  ", 1
"acing a president who denies the reality of climate change, we need to mobilize together. join me. ", 1
" got news today that was so awesome it made me forget about global warming and now i know what it was like to be a ", 0
"he fix: can pope francis actually change americans minds on climate change? ", 0
"ime to act truml, act fast and hard on climate change. ", 1
"eteorologist: accepting climate change doesnt make you liberal, it makes you scientifically literate ", 1
"his cabinet choices are idiots, climate change deniers, and bigots. ", 1
"limate change is bullshit. cofounder of greenpeace even said he was wrong. it's the suns activity you f ", -1
"pa chief: carbon dioxide not 'primary contributor' to climate change  the cesspoo", 1
"was just on to talk about climate change... not one mention of isis", -1
"acron drops climate change joke about trump at davos  via is global warming real", 0
"razy for believing in the truths of climate change and the lasting repercussions", 1
"equest the government finish their climate change-disasters building code safety factors project before any other ", 1
"his is an important meeting regarding the cross-party response to climate change. please share widely... ", 1
"ind energy is supposed to help fight climate change. it turns out climate change is fighting back.: a changing cli ", 1
"odi not in the list for 'plastic surgery' or 'climate change .... shardi sahan karne ' remarks. ", 0
"artly due to climate change, vultures are moving more northward, toward 2018 gop d.c. roadkill", 1
"pa chief pruitt..sniff too many fumes?  look thru the smog ur making. climate change is man-made. #climate chang", 1
"nd at the same time it is a fundamental defensive measure against the global climate change. project ark ", 0
"ard to believe a species brilliant enough to accomplish this can behave so ignorantly regarding issues like #climate change", 1
"eattles congestion: we are not amsterdam; build a livable city; climate change urgency; stay out of seattle ", 1
"f you're able to turn a blind eye to climate change &amp; consider it an issue for thirty years down the line, you're very wrong", 1
"oday, this little girl i work with said this: kaysee started global warming and trump stopped it.   the children are our future.", 0
"nconvenient data? whistle blower says noaa scientist cooked climate change books  ", -1
"eriously, though, would saying 'climate change is an alien conspiracy' really be any sillier than denying its existence completel", 1
"he case for #geoengineering climate change, via  #sustainabilit", 1
"t hurts us: it snowed once and other things donald trump thinks prove global warming is a hoax  via", 1
"illary blames women on climate chang", 0
"rotected: executive perspective: no more denying: climate change action and gender equality and womens empowermen ", 1
"here are all those 'free speech' people and why aren't that protesting trump's censorship of 'climate change' ??", 1
"efining the climate science will be essential for firms' ability to adapt to global warming  via", 1
"m creating a new think tank for climate change, would you join and post your tweet also at  ", 1
"on climate change - we will fix this in 85 years, 86 tops", 0
"ick perry wants to hold a dangerous, totally bs debate on human-caused global warming ", 1
"ut dont worry, climate change isnt real..", 1
"nd you think that disproves global warming, right? like senator inhoffe's snowball...  global warming m ", 1
"ach doesn't believe in global warming? lolol okay..", 0
"scientific #app #fintech #tips #seotips #socialnetwork *the best solution to eliminate the climate change is in: ", 1
"hrough climate change denial, we're ceding global leadership tochina ", 1
"ublish the address of climate change deniers like you who are destroying our planet's env ", 1
"oon aap will blame them for global warming': twitter mocks preeti sharma menon for blaming evms fo exit polls ", 0
"4 in november. s/o climate chang", 0
"oom: climate change causing plants to choke on too muchcarbon ", 1
"onsidering the people who drive (and deny) climate change, this is probably true. fuckers", 1
" just joined in combating climate change. take action #beforetheflood ", 1
"limate change is real climate change is real climate change is real climate change is real climate change is real climate change is real c", 1
"hoa. makes sense now why they wanted names of people working on climate change, don't it? ", 1
"ost people sit in aircon offices/houses now then go outside an think because its hot it must be climate chang", -1
"hese calamities are due to climate change , global warming, melting of glaciers ,poles ice caps, tectonic plate... ", 1
"o such thing but in the minds of the week who wish to be controlled by the elite  ", -1
"onald trump appears to misunderstand basic facts of climate change in piers morgan interview. ", 1
"weather obama disses climate change deniers: president barack obama dissed those who deny the science a...  #new", 1
"social #hr #reachwest apple makes an eloquent plea to take climate change seriously ", 1
"othing is wise when it comes to global warming. #fars", 0
"e don't need to be an indigenous person to show support. its time to treat the native right and take climate change seriously #nodap", 1
"e: inciting political violence is bad.   this dude: lol you care about climate change! ", 0
"climatechange the drum how twitter and carbon brief are helping climate change scientists  ", 1
"ermonts seemingly spacey climate change goals are putting the rest of the country to shame. ", 1
