"epublican candidates might as well ignore climate change since they have no plans to do anything about it - ... - ", 1
"nosmokingcar a very polluted city now a day cars smoke increase global warming. please drive electric cars ", 1
"t this point, i am done trying to convince anyone that climate change is real. its absurd. see, the book fell! gravity is real!", 1
" was like do you believe in global warmin", 0
"he co-founder of the weather channel is a climate change opponent.   #gm", 0
"es and orange hitler wants a climate change denier to head the epa. #theresistanc", 1
"orld global warming alarmist nations ignore greenland's record icecap. ", -1
"ow big of a problem has climate change already become?  #climatechange #climateaction ", 1
"ut big questions remain on #trump foreign policy, climate change agreement, wall with mexico, iran deal, nato, ira ", 0
"rump attaccato per aver detto quello che gi molti pensano, ossia che il global warming sia una balla inventata per interessi", 0
"o basically yes, hurricanes will continue to happen like always but global warming only intensifies them", 1
"scientism is needed to have faith in global warming. #nasa is more fake than msm. tuition seems rath ", 0
"our climate change comment: ignorance or lie? one or the other. it is no longer in question", 1
"ou have zero science knowledge but think you can dispute carbon dioxide's role in climate change? #zerospine #unqualifie", 1
"on't tell the global warming people this! nature at work on its own. wow, what a concept! yes,co2 had left a prin", -1
"limate change$q$s effects are devastating. denying the science behind it does...  by #barackobama via", 1
"here is plenty of evidence of climate change. however there is few evidence for denial. come on ", 1
"xxon mobil says its not possible to predict how climate change will affect its business. a bill in congress says it shouldnt be asked to", 0
"q$trees deal with climate change better than expected$q$ by tatiana schlossberg via nyt  #protegoau #scienc", 1
"irst they deny climate change and now they can't even spell #hurricaneirma right #hurrcaneirm", 1
"ey libs, if global warming is real then why is my ex-wife's heart so cold", 0
"ailing about global warming is always the default position after things like getting spanked on trumps taxes. ", -1
" recall obama tried to have dissent outlawed on climate change. ", -1
"he answer to climate change is not insuranc", 1
"es, please dolisten to branson. he supports gas as part of the logical solution to climate change. listen to all his idea", 1
"  bernie sanders: trump's 'days are numbered' for ignoring climate change ", 0
" went to a trial where the prairie plot was losing overall c from depth. no tillage, fert but less c. they blamed global warmin", 0
"rolls , games they play &amp; global warming -  #itrt", 0
"eant bipolar not climate chang", 0
"s related to climate change or due to that only,i have come here!!! but yesss when to say or talk about the very l ", 0
"hatever you do, don't question global warming. it is real, bill nye said so. ", 1
"climatechange  the challenges posed by climate change require a coordinated medium-term to long-term strategy at c ", 1
"ut trump doesn't believe in global warming. yes i brought it up", 0
"an-made climate change like man-made global warming is a lie and a hoax. it is all about the power ", -1
"esearchers identify more and more clearly the impacts of global warming on the weather ", 1
"aybe you should go back to uzbekistan? i'm sure that they believe in climate change! lol", -1
"ood beer is the newest victim of climate change    brussels  one of the most renowned belgian beer brewers said ", 1
"t article on climate change in our country. prizefighter  as voters judge in the midst the quartet runner vying r ", 0
"ay what? that makes global warming just more fake news doesn't it .", -1
"o , how do you explain the 70 degree weather we had in scranton here today &amp; now snow if global warming is 'made up'", 1
"ut still don't believe nasa scientists when it comes to climate change #climatechang", 1
"nergy day comes as major companies lead the fight against climate change ", 1
"top the madness: the plight of climate change, the responsibilities and hope for change #greens2017   ", 1
"here's a link between climate change and immigration. ", 1
"lap on efforts to stop global warming as well", 1
"'m sorry but if you think you are going to end policies that prevent climate change you are 'wrong'", 1
" hear you were sent to climate change school! love it that you and melania could do something other t ", 0
"ow climate change is starving our coral reefs - the week magazine ", 1
"nd of course climate change looms over us all. damnit. we got a f'd up system and the world we live on is dying at the same time", 1
"outh need to take charge of existing processes in climate chang", 1
"bama, billy ayers, soros, valarie jarrett etc formed the chicago climate exchange to sell bs global warming ", -1
"nly climate change i want is for the glaciers move to my future wife's ring finger.", 0
"e need to act now! #drought ", 1
"ichael bloomberg and mark carney: how to make a profit from defeating climate change | opinion | theguardian ", 1
"re 199 class working on posters for group projects on various climate change topics. ", 0
"e gust un video de  #ourstolose: climate change affects the things we lov", 1
"e shouldn't expect the pm to be the only culprit for inaction on climate change. there is a whole bunch in people in government#qand", 1
"015 story no. 5: the phantom menace (of global warming) - the federalist   - #globalwarmin", 0
"hen global warming really hits, somehow climate change deniers will overnight shift gears and bl ", 1
"f you aren't watching leonardo's documentary on climate change then wy", 0
"rump's america: an 'attack' on climate change fight  ", 1
"f climate change is real why am i so fucking cold right no", -1
"up, a climate change denier could be #president. what could possibly go wrong? #nevertrump #glacialmelt #searise ", 1
"deology completely trumps other group identities when considering views on climate change science. re: pope franci ", 0
"hey could chat about climate change while they're at it. knows it's real", 1
"s climate change real?'  no", -1
"hat a surprise. #p2 #dems #gop 'trump to sack climate change scientists and slash epa budgets, says official'  ", 1
"anart of climate change! fanart of the dangers of humanizing propagandists! fanart of the vitality of human connections", 1
"f climate change isn't real, then why are global temperatures rising, despite low solar activity", 1
"nd global warming and racial inequality and equal pay and...and...an", 0
"ouch! nyt loses credibility by doing this. there is no scientific doubt that climate change is happenin ", 1
"o let me get this straight the ice is growing but climate change is happening right", -1
"his is criminal: trump, turnbull cut from the same cloth: epa head pruitt denies that co2 causes global warming ", 1
"ou know what else is facing five goliaths? america. al-qaeda, global warming, sex predators, mercury poisoning. so do we just give up", 1
"itally important new report and survey on how to engage with the public about climate change from ", 1
"ow to fix climate change: put cities, not countries, in charge | benjamin barber ", 1
"'m one of those people who doesn't believe in global warming but i'm pretty sure noah's ark was a true story' hahah", 1
"his graphic explains why 2 degrees of global warming will be way worse than 1.5 ", 1
"ood to see. and worth pointing out that it was specifically climate change that topped the poll, not plastic waste. ", 1
"ow bucking climate change accord would hinder fight against hiv/aids  ", 1
"or all those who say global warming doesn't exist, spongebob is homeless now. ", 0
"20 rolls back on free trade &amp; climate change after us pressure  + import restrictions for booze etc after brexi", 0
"let's zero out climate change with nature &amp; agriculture instead #mohempkenya snippet ", 1
"iver piracy' is the latest weird thing to come out of climate change  ", 1
"il industry knew about climate change before we landed on the moon -  most people then knew the climate changes", -1
"ets celebrate no breathing day...it will reduce amount of carbon dioxide in envt and in turn reduce global warming...!!", 0
"5 most popular slogans on global warming  #globalwarmin", 0
"oug ducey: increase climate change education in az high schools. - sign the petition!  via #itmatter", 1
"immy kimmel has actual scientists exclaiming they$q$re #notfingwithyou as denies climate change.  ", 1
"ey ken i've been a meteorologist for 37yrs and climate change is bull! it's nothing more than cheat ", -1
"ying of climate change", 0
"s climate change real?' mixed the words up - should read 'climate change is real.' #climatechange ", 1
"pl that voted for trump: you set our earth back. you voted for continuous global warming and harm to our animals, oceans and forests. nice", 1
" wish i could be there. i'm listening to two vets talk about how climate change is a hoax but ufos are real. i'm very amuse", 1
"eason for global warming and lack of rain  and solution     please watch thi", 0
"reat response from - understands the issues of housing, youth issues, climate change, transport and taxation.  #budget1", 1
"u communication campaign on climate change. audio/video material 2014.  #climatechange ", 0
"0 #megacities in the c40 need to raise $375b by 2020 to follow through on commitment to tackle climate change. ", 1
"limate change is already disrupting delicately balanced penguin colonies  ", 1
"ttention coffee lovers: science says climate change is threatening the worlds supply justinjbariso  #bi", 1
"aybe just a graph woulda been easier? ... a little more climate change frien- *escorted away into abyss by secret ", 0
"ou know, you could ever be a refugee because of global warming causing floods and desertifi ", 1
"es. youre acting like its insane to blame extreme cold temperatures on global warming as if global war ", 1
"race yourself for a bitterly cold winter, as climate change shifts the polar vortex  ", 1
"hanks for the great documentary on climate change. it really hit home! please check out this project ", 1
"e should have said thanks obama for wasting our money on climate change. ", -1
"opefully someone had the foresight to consider climate change when the ethiopian renaissance dam started to be so ", 1
"etting women actively involved in climate change mitigation ", 1
"airpollution arnold schwarzenegger with some sense on climate change -   via", 1
"eneliti: pemakaian hot pants berkontribusi besar pada dampak global warmin", 0
"he best part is the listing for the global warming article!!! trump is such an idiot", 1
"ou elected someone who doesn't even believe in climate change you know how stupid you have to be to not believe in climate chang", 1
"lease watch chasing coral on netflix, and maybe you'll believe in global warming !!", 1
" do not remember mlk ever talking about man-made global warming", 0
"limate change is the main false pretext the illuminati are pushing for both world government &amp; $100 trillion tax ", -1
"bsolute moron - #epa head scott pruitt denies that carbon dioxide causes global warming ", 1
"robably right, but had to challenge him given he doesn't know if climate change is real or not. he should visit tuvalu, kiribat", 1
" believe we should reframe our response to climate change as an imper... #williamhague #quotes ", 1
"ayette takes on climate change deniers and horoscopes at science conference - politi   ", 1
"daho soon expects to grow baked potatoes in the ground thanks to climate change. no need to cook, just dig em up, ", 1
" thought you'd like to know that pasta in mystery red sauce and climate change were on the menu tonight ", 0
"ts always them walking out of the room or getting mad when they state facts. yall shouldve seen the hurt faces in my global warming clas", 0
"lobal warming will cause more snowstorms. do you even science bro? heat mixes with... oh just forget i", 0
"ot sure how knows about the nametags, but we see is mentioned in these hbs climate change ", 0
"ow:  please join our national stop global warming conference call 9pm et!   #climate ", 1
"ut global warming is a hoa", -1
"ig: flew depression: cured climate change: ended ", 0
"t is the one and only reason of climate change.", 0
"'m married to a scientist who really knows about climate change.   trump knows nothing. ", 1
"ow does one not believe in global warming", 1
"lobal warming. look up the origin - agenda 21 - 'one common enemy.", 0
"pa chief clings to his own fantasy by denying overwhelming evidence on co2 and climate change via /r/worldnews ", 1
"here is no debate  climate change is happening. the entirety of our year-long project, the united states of clima ", 1
"ake a stand for the climate in honor of earth day and sign climate change petition ", 1
"hy isn't nuclear power considered as a viable energy source to fight climate change? by dmitrii motorygin ", 1
"nd yet twitter is full of climate change deniers and the worlds remains silent! what can we do to stop this??", 1
"his climate change is giving me depression and i dont know what to do about i", 1
"igh level #climate change adaptation panel discussion ongoing. prof shem wandiga says no 'silver bullet for adapta ", 1
"his is word salad. just spewing gibberish hoping some fools fall for your race hustling and climate change scam! s ", -1
"gt;reduce us mutt population by 50% &gt;climate change has been fixed the decadent mcdonalds lifestyle of 1 ", 1
"ts 20 degrees here and global warming is not even on my list of things to be concerned about", 0
"ealalexjones: rt prisonplanet: leonardo dicaprio lectures oscars about global warming after using private jet 6 times in 6 months -", -1
"lizzard of global warming blankets u.s. east coast -  (my thoughts exactly) #tby", -1
"sk a scientist from binghamton university: can we overcome global warming? ", 1
"50m that could have gone to help fight climate change instead. ", 1
"illary clinton and donald trump on climate change ", 0
"orkshopping a tweet about climate change and the hit song all star by smashmout", 0
"uts=&gt; chief blames bostons worst winter ever on global warming (video) ", -1
"n the 70's the propaganda was 'the next ice age is just around the corner'. now it's 'global warming'. ", -1
"ut akh i just need someone to educate me on the ramifications of my actions on global warming. ffs. ", 1
"hina and india are the guilty of causing what climate change were experiencing today. shut them down! ", 1
"e telling folk at #marchforscience in #chicago we must drive climate change &amp; science of evolution denying #trump ", 1
"ost people dont know climate change is entirely human-made | new scientist ", 1
"limate change is good??", 0
"tarting off the day with my coworker arguing that climate change is a hoax ", 1
"hat $52-billion road bill just made california's next climate change move a heavy lif", 1
"pocalypse not now? science now says global warming has caused the ocean to sink ", 1
"r. bryan fischer, climate change extraordinaire", 0
"s it really a surprise that oil giants were always wise to climate change?  #shellknew - just didn't care  ", 1
" know global warming is bad but i'm not hating wearing shorts and tank tops in februar", 1
"e's filled his transition team with fossil fuel industry stalwarts &amp; lobbyists, while continueing to deny climate change is real. scary", 1
"t's art right? maybe it's a statement piece about the global warming caused by greedy craven white guys", 1
"lobal warming. oh i'm sorry we changed the name cuz there is no global warming", -1
"ore money required and a hope will return to the paris agreement on tackling climate change. eamon ryan of ", 1
"limate change is bringing more mosquitoes to the arctic | the verge ", 1
"ppears #trump had team of archaeologists building gov. hard to find climate change denier for epa or 'what nukes in my dept' for energy", 1
"en of the ugliest animals threatened by climate change  ", 1
"s the humble sandwich a climate change culprit? - new atlas ", 1
"oal is not just dying, it is dead ...  lloyd's of london to divest from coal over climate change ", 1
"ast year issued the largest us #green bond to fight global warming and they're doing it again #kindworld ", 1
"id climate change scare off vegan dinos for millions of years? $q$yes$q$ ", 0
"his is the time to talk about climate change. we are running out of time", 1
"y stepdad just 100% denied climate change and i'm fucked u", 1
"iewers need to ask questions about your manipulation of the weather. not climate change plans as in weather weapons", 0
"ts dirty, contributes to climate change and it needs to stop. very few permanent jobs are created fr ", 1
"urope getting their ass kicked by terrorists ---at least their doing something about global warming. #londonbridge #realdonaldtrump #meric", -1
"ost people don't see how climate change is affecting their livesand that's a problem  ", 1
"arry is introducing someone to the dangers of global warming tomorro", 0
"aking on sas first climate change lawsuit #resist ", 1
"he larsen c ice shelf collapse hammers home the reality of climate change ", 1
"ey, we are all fucked. welcome to earth where it snows, rains, gets hot and where the people say climate change is a hoa", 1
"ow did we elect such a dumbass. climate change?! really", -1
"iti calls for recession in 2016?  recessions caused by global warming.  every democrat will tell you that", -1
"onald trump appears to misunderstand basic facts of climate change in piers morgan interview ", 1
"ust saw an eshay adlay carrying roses, after seeing a car towing a tow truck yesterday. climate change is real guys #auspo", 0
"rump falsely claims that nobody knows if global warming is real - mashable ", 1
"ew pitbull single called climate change", 0
"olololololol. oceans are rising even without climate change ", 0
"ports -&gt; social justice -&gt; puppies -&gt; sports -&gt; global warming etc etc et", 0
"rankenstein know climate change real. frankenstein know man want be god. god make world. man destroy... ", 0
"otice all the climate change happening on jupiter from our coal power plants, suvs, and cow farts  #scienceisreal", -1
"oaas climate change sciencefiction ", -1
"lease wake up folks. the donald's soon to be cabinet is a who's who of climate change skeptics, homophobes, racist ", 1
"his pipeline will only increase global warming. keep oil in the ground. #nodapl  natives fighting for mother earth ", 1
"toring carbon in soils of crop, grazing t rangelands offers ag$q$s highest potential source of climate change mi.igation", 1
"hey also deny climate change (chinese hoax, right", 0
"rumps pick for environmental adviser got grilled on climate change. it was a trainwreck. ", 1
"hy is everyone in bill's pic dressed in layers?  are they global warming deniers?  #standupforscience   ", 1
"ut it wasn$q$t terrorism; it was workplace violence or climate change or something", 0
". didn't believe in facts &amp; in global warming which he could see with his own 2 white/orange eyes if he'd have wanted too", 1
"hat does god say about climate change bill?", 0
"o climate change is science, the colors of the rainbow (and abortion) are about choice, not science   #liberallogi", -1
"-art &amp; climate change | 6th balance-unbalance conference | call papers/works  ", 0
"t's 80 degrees on november first climate change is real we're in a drought the reef is dead bees are dying donald trump might be presiden", 1
"verpopulation is the number one cause of climate change", 1
"ou're talking about people who don't believe in climate change. you think they care about nuclear war", 1
"et the dirt: what does climate change have to do with soil health  and food?  #actonclimate ", 1
"lobal warming is a hoax. ", -1
"ell of course he is. i wish obama would tweet out that climate change is fake, he hates insurance and nuclear war is great..", 0
"hen i was a kid it snowed all the time...yes, i do believe in global warming.' -brian fry", 1
" want action to address climate change to be up front on the agenda #tellny", 1
"ollow for actual science and climate change facts", 1
"ope you'll check out our podcast episode on economic impacts of climate change, as well as their imp ", 1
"he coastline, for when we cross it, it is an early warning sign that climate change-fuelled flooding will kill us ", 1
"eet the first animal to go extinct from human-induced climate change ", 1
"nd of world? british scientists challenge un global warming predictions  climate barbie will love this", -1
"his map reveals which countries will survive climate change (and which countries are in b...  via", 1
"oday i discussed colonialism, climate change, and the plot of aristocats en espaol so i'm feelin pretty fin", 1
"ets take the lead on a serious worldwide counterterror force to replace the silly global warming non-binding and said yes", -1
"ther people$q$s concern: global warming, economy, nuclear energy my concern: nagpur mein india ko pehle batting krni chaiye ya bowling.", 0
"his global warming video said people eat an average of 3 burgers a week, i said bitch where?!?", 0
"ver heard of global warming? ice burgs are almost extinct y", 0
"the carbon emissions coming out of coal are gonna spike global warming up high enough to kill us all~rivera su", 1
"aveat reader! :) lots of popular climate change articles arent totally credible, scientists say. ", 0
"$q$m laughing through my tears and smog mask. ", 0
"ear florida: you're gonna be real pissed when trump administration stops fighting against global warming and you're the first ones to g", 1
"o a political science major is an expert on climate change..... ", 0
"ust be that damn climate change", 0
"olitical climate change", 0
"o now you have national agencies, asked to delete tweets about inauguration crowd, climate change etc bcoz it doesn't fit trump's opinion", 1
"en. wagner blames body heat, earth slow death spiral into sun for climate change ", 1
"n the issue of climate change, the social responsibility argument is increasingly lining up with the financial one ", 1
"reen energy, climate change &amp; common core are all about money", -1
"hut it down &amp; arrest or fire all of these democrat saboteurs, their 'climate change' hoax &amp; lies end right no", -1
"ever realized blocking so many idiots on twitter could be so rewarding. see if i can get a few more. global warming is a thing! #takeajok", 1
"rump to build anti-climate change wall to protect his golf course in ireland.... ", 1
"ust wait till its your family threatened and you may understand that right now they need compassion not a lecture! ", 0
"up., all the real data ofchange can be found on the internet (where everything is true ). ", 0
"hats alarming for the climate change alarmists .... (see what i did ?) the worlds lungs were created to use up c02 ", -1
"he sea floor is sinking under the weight of climate change ", 1
"all it taking care of the land. call it good business sense. just don't call it climate change. ", 0
"espite global warming, some reefs are flourishing, &amp; you can see it in 3d' quartz  #environment #animalia #scienc", 0
"he change has been so drastic in colorado my frequent snarky phrase of the year is, oh but dont worry, global warming isnt rea", 1
"e reading article abt climate change: oh no!!! this is so bad!! we gotta do something!!!! me reading the comments: nvm fucking kill us al", 1
"our policies on climate change are wrong. here in maryland february is usually really cold, but today it is 70 degrees", 1
"enying climate change is dangerous. join the world's future. his essay as wireds guest editor", 1
"he upside of addressing climate change:  #ft$q$s #martinwolf on the potential economic benefit", 1
"ear about how youth are leading the fight to prevent climate change at climate outloud, saturday at 2 pm ", 1
"ecomposition of organic wastes&amp;cattle manure stored outdoors emits methane&amp;nitrous oxide having23&amp;310times global warming potential of co", 1
"hings old ppl decided to make us fix: global warming mass incarceration social security and now giant wave of western civ fascis", 1
"et's hope obama's last days as president aren't spent trying to prove catastrophic man made global warming. ", 1
"ets not forget the gop is also the same party that denies climate change, they think everythi ", 1
"ust fucking do a incendiary airstrike or something on syria. or chemical warfare. fuck global warming just do it", 0
"f your over 30 and still playing with guns like toys....my you shoot yourself in the face and die...global warming is here we need the roo", 0
"ove it, obama was an idiot, obama was just interested in climate change. wo", -1
"rump said climate change does not exist. you just contradicted yourself. clean environment means no coal/oil/frackin", 1
"pa administrator scott pruitt said that co2 emitted by human activity is not the key cause of climate change. pants afir", 1
"illionaires, liberals at highest positions.a trillion $ stimulus, tariffs, amnesty,global warming..", 0
"hy climate change could be impacting your healthand even your skin  #fashion #style #trend ", 1
"nergy department climate change office bans climate change language  yes, you read that right  via", 1
"ot weekend? to the coast tonight, talk on how social change can combat climate change: 7.30pm phoenix centre, lewes ", 1
"cott pruitt wants some kind of strange climate change showdown  ", 1
"ans rosling dies today - see his population and climate change video ", 0
"xxon lied about climate change threat to humanity for 30+ yrs. why? demand an investigation: ", 1
"there's debate about climate change.' 'not really.' 'yes there is. we're debating right now.' 'i've seen this skit.", 0
